Titre de la section,Contenu,Nom du professeur,Titre du cours,Titre de la vidéo,Durée du cours,Description du professeur,Description du professeur,Source
Codez un site web accessible avec HTML & CSS,"Ce cours est visiblegratuitement en ligne. course.header.alt.is_video course.header.alt.is_certifying Mis à jour le 01/08/2023  Bonjour et bienvenue dans ce cours sur l’accessibilité sur le Web pour les développeurs. 🙂 Je m’appelle Thomas Dimnet, je suis le CTO de SensCritique, et mentor chez OpenClassrooms. Ce cours a pourobjectifde vous aider àintégrer une démarche d'accessibilité lors de vos développements web. Nous verrons notamment dans ce cours : les bonnes pratiques d’accessibilité à adopterquand vous développez votre page web ; les attributs ARIAqui vous aideront dans votre démarche d’accessibilité ; comment rendre accessibles les interactions, comme compléter un formulaire ou ouvrir une modale. Pour bien saisir l’ensemble de ce cours et appliquer les concepts dont nous allons parler, il vous est nécessaire d’être familier : avec le concept d’accessibilité, de connaître ce qu’est ARIA. Si ce n’est pas le cas, commencez par suivre le coursConcevez un contenu web accessible, avant de revenir sur ce cours ; le HTML et le CSS. En effet, ce cours va tirer parti de ces deux langages, notamment de nombreux attributs HTML, pour construire un site accessible. La connaissance du JavaScript n’est pas nécessaire pour suivre et comprendre ce cours. Chaque concept lié au JavaScript sera expliqué en détail dans des encarts info comme celui-ci. 🙂 Ce cours couvre de nombreux aspects de la programmation de site web prenant en compte les contraintes d’accessibilité. Selon votre profil, votre objectif, vous aurez plusieurs manières possibles de suivre ce cours : Si vous travaillez sur ungros projet de développement webet avez besoin de compétences sur l’ensemble de la programmation accessible, vous pouvez suivre le cours entier : lire le texte et faire les quiz pour vérifier vos connaissances. Dans ce cas, je vous conseille vivement d’appliquer en parallèle, grâce aux exemples donnés à la fin de chaque chapitre. Si vous ne travaillez que surune partie spécifique de la programmation web, un élément particulier d’une page, je vous invite à passer directement au chapitre en question. Si, enfin,vous vous intéressez à l’accessibilité weben général, sans nécessairement vouloir appliquer, en ce cas vous pouvez passer le cours en revu, lire les résumés de chapitres et ne rentrer dans le détail des textes que quand le sujet vous intéresse particulièrement. Dans ce cours, vous allez découvrir les techniques qui vont vous permettre de coder des sites web accessibles à tous ! Quand on pense à l’accessibilité, on pense souvent aux personnes ayant destroubles visuels. Mais le principe même del’accessibilité est de rendre un site ou une application web utilisable par le plus grand nombre. Autrement dit, vous vous adressez à un public qui peut avoir : desdéficiences visuelles(aveugles, daltoniens, personnes ayant des glaucomes, etc.) ; desdéficiences de motricité(pour des personnes ayant subi un AVC, par exemple) ; une connaissance limitée devotre langue(publics étrangers). Par exemple, admettons que votre site dispose de vidéos. Le fait de les sous-titrer va les rendre accessibles aux personnes ayant des problèmes auditifs. Mais cela va aussi permettre aux personnes n’ayant pas de son sur leur ordinateur, ou à ceux ne parlant pas votre langue, de les comprendre. Faire un site web accessible, c’est donc créer un site utilisable et compréhensible pour le plus grand nombre de personnes. Vous trouverez dans ce cours : du textevous permettant : deprésenter les notionsen détail et donner des conseils, de donner desexemplesdes concepts que je présente, departager des liensvers des ressources complémentaires, telles que des articles de blog ; des quizvous permettant de valider les connaissances acquises durant le cours ; et, enfin,un projet “Tonight in Gotham” qui nous servira de cas d’applicationtout au long des chapitres. À chaque fin de chapitre, vous trouverez un cas pratique d'application des concepts à ce projet. Comme toujours avec les cours OpenClassrooms, il est important de pratiquer tout au long de ce cours. Je vous invite donc à essayer d’appliquer le plus possible les concepts. Vous pouvez, par exemple, le faire : via vos projets OpenClassrooms si vous suivez un parcours chez nous ; via un projet personnel (c’est souvent le bon moment de tester une nouvelle technologie ou un nouveau concept et de le faire progressivement) ; via votre travail (si vous êtes déjà développeur), en en parlant à vos collègues et/ou en essayant de l’intégrer à votre entreprise. En plus des snippets de code et des exemples d’applicationque vous allez pouvoir voir durant ce cours,nous allons travailler sur un projet. Ce projet va être lefil rouge de notre cours. Pour chaque chapitre de chaque partie,le cours se divisera généralement en deux grandes sections: une ou plusieurs sectionsnotions + exemples, où je vous expliquerai les concepts et où je vous donnerai des exemples d’application ; une dernière section où nous intégrerons ensemble la maquette d’une landing page au fil des chapitres. Vous pouvez dès à présent télécharger les sources du projet créé que nous allons implémentersur ce projet Figma. Vous pouvez trouver le code source de cette application sur cerepository GitHub. À chaque fin de chapitre, vous trouverez un lien GitHub qui vous permettra de voir l’état du code une fois les étapes du chapitre implémentées. Vous n’avez pas besoin de maîtriser Git et GitHub pour réaliser ce cours. Néanmoins, être familier avec le versioning, et notamment avec le concept de branche, va vous permettre de vous repérer plus facilement dans les modifications effectuées entre chaque chapitre. Pour en savoir plus sur l’utilisation de Git et GitHub, je vous invite à suivre le coursGérez du code avec Git et GitHub. Pour que vous puissiez mettre en pratique ce que nous allons voir dans ce cours, nous allons travailler sur un projet de création d’une page de blog. Notre projet va donc porter sur Batman ! Vous pouvez voir sur la maquette ci-dessus qu’il est composé : d’un header avec un menu de navigation, une barre de recherche et un menu déroulant ; du corps principal avec le corps du texte, ainsi que d’une image ; d’un footer comprenant un second menu de navigation et des liens vers les réseaux sociaux. Ce cours inclut des textes, un projet fil rouge réalisé sous forme de screencast ainsi que des quizzes. Le projet de landing page vu tout au long du cours va vous permettre de mettre en pratique les éléments clés vus durant le cours. Vous devez avoir un peu pratiqué le HTML/CSS pour saisir l’ensemble du cours. Nous allons maintenant voir comment créer un squelette de page accessible, en utilisant la sémantique et les attributs ARIA. Le téléchargement des vidéos de nos cours est accessible pour les membres Premium. Vous pouvez toutefois les visionner en streaming gratuitement. Le téléchargement des vidéos de nos cours est accessible pour les membres Premium. Vous pouvez toutefois les visionner en streaming gratuitement. Si vous aimez mes cours, vous aimerez : beta.nx.academy Inclusive designer and digital accessibility specialist from Toronto, Canada.",Thomas Dimnet,Codez un site web accessible avec HTML & CSS,"
                            Tirez le maximum de ce cours - Codez un site web accessible avec HTML & CSS - OpenClassrooms
                    ",6 heures,"Si vous aimez mes cours, vous aimerez : beta.nx.academy","Si vous aimez mes cours, vous aimerez : beta.nx.academy",https://vimeo.com/472965194/
Tirez le maximum de ce cours,"Bonjour et bienvenue dans ce cours sur l’accessibilité sur le Web pour les développeurs. 🙂 Je m’appelle Thomas Dimnet, je suis le CTO de SensCritique, et mentor chez OpenClassrooms. Ce cours a pourobjectifde vous aider àintégrer une démarche d'accessibilité lors de vos développements web. Nous verrons notamment dans ce cours : les bonnes pratiques d’accessibilité à adopterquand vous développez votre page web ; les attributs ARIAqui vous aideront dans votre démarche d’accessibilité ; comment rendre accessibles les interactions, comme compléter un formulaire ou ouvrir une modale. Pour bien saisir l’ensemble de ce cours et appliquer les concepts dont nous allons parler, il vous est nécessaire d’être familier : avec le concept d’accessibilité, de connaître ce qu’est ARIA. Si ce n’est pas le cas, commencez par suivre le coursConcevez un contenu web accessible, avant de revenir sur ce cours ; le HTML et le CSS. En effet, ce cours va tirer parti de ces deux langages, notamment de nombreux attributs HTML, pour construire un site accessible. La connaissance du JavaScript n’est pas nécessaire pour suivre et comprendre ce cours. Chaque concept lié au JavaScript sera expliqué en détail dans des encarts info comme celui-ci. 🙂 Ce cours couvre de nombreux aspects de la programmation de site web prenant en compte les contraintes d’accessibilité. Selon votre profil, votre objectif, vous aurez plusieurs manières possibles de suivre ce cours : Si vous travaillez sur ungros projet de développement webet avez besoin de compétences sur l’ensemble de la programmation accessible, vous pouvez suivre le cours entier : lire le texte et faire les quiz pour vérifier vos connaissances. Dans ce cas, je vous conseille vivement d’appliquer en parallèle, grâce aux exemples donnés à la fin de chaque chapitre. Si vous ne travaillez que surune partie spécifique de la programmation web, un élément particulier d’une page, je vous invite à passer directement au chapitre en question. Si, enfin,vous vous intéressez à l’accessibilité weben général, sans nécessairement vouloir appliquer, en ce cas vous pouvez passer le cours en revu, lire les résumés de chapitres et ne rentrer dans le détail des textes que quand le sujet vous intéresse particulièrement. Dans ce cours, vous allez découvrir les techniques qui vont vous permettre de coder des sites web accessibles à tous ! Quand on pense à l’accessibilité, on pense souvent aux personnes ayant destroubles visuels. Mais le principe même del’accessibilité est de rendre un site ou une application web utilisable par le plus grand nombre. Autrement dit, vous vous adressez à un public qui peut avoir : desdéficiences visuelles(aveugles, daltoniens, personnes ayant des glaucomes, etc.) ; desdéficiences de motricité(pour des personnes ayant subi un AVC, par exemple) ; une connaissance limitée devotre langue(publics étrangers). Par exemple, admettons que votre site dispose de vidéos. Le fait de les sous-titrer va les rendre accessibles aux personnes ayant des problèmes auditifs. Mais cela va aussi permettre aux personnes n’ayant pas de son sur leur ordinateur, ou à ceux ne parlant pas votre langue, de les comprendre. Faire un site web accessible, c’est donc créer un site utilisable et compréhensible pour le plus grand nombre de personnes. Vous trouverez dans ce cours : du textevous permettant : deprésenter les notionsen détail et donner des conseils, de donner desexemplesdes concepts que je présente, departager des liensvers des ressources complémentaires, telles que des articles de blog ; des quizvous permettant de valider les connaissances acquises durant le cours ; et, enfin,un projet “Tonight in Gotham” qui nous servira de cas d’applicationtout au long des chapitres. À chaque fin de chapitre, vous trouverez un cas pratique d'application des concepts à ce projet. Comme toujours avec les cours OpenClassrooms, il est important de pratiquer tout au long de ce cours. Je vous invite donc à essayer d’appliquer le plus possible les concepts. Vous pouvez, par exemple, le faire : via vos projets OpenClassrooms si vous suivez un parcours chez nous ; via un projet personnel (c’est souvent le bon moment de tester une nouvelle technologie ou un nouveau concept et de le faire progressivement) ; via votre travail (si vous êtes déjà développeur), en en parlant à vos collègues et/ou en essayant de l’intégrer à votre entreprise. En plus des snippets de code et des exemples d’applicationque vous allez pouvoir voir durant ce cours,nous allons travailler sur un projet. Ce projet va être lefil rouge de notre cours. Pour chaque chapitre de chaque partie,le cours se divisera généralement en deux grandes sections: une ou plusieurs sectionsnotions + exemples, où je vous expliquerai les concepts et où je vous donnerai des exemples d’application ; une dernière section où nous intégrerons ensemble la maquette d’une landing page au fil des chapitres. Vous pouvez dès à présent télécharger les sources du projet créé que nous allons implémentersur ce projet Figma. Vous pouvez trouver le code source de cette application sur cerepository GitHub. À chaque fin de chapitre, vous trouverez un lien GitHub qui vous permettra de voir l’état du code une fois les étapes du chapitre implémentées. Vous n’avez pas besoin de maîtriser Git et GitHub pour réaliser ce cours. Néanmoins, être familier avec le versioning, et notamment avec le concept de branche, va vous permettre de vous repérer plus facilement dans les modifications effectuées entre chaque chapitre. Pour en savoir plus sur l’utilisation de Git et GitHub, je vous invite à suivre le coursGérez du code avec Git et GitHub. Pour que vous puissiez mettre en pratique ce que nous allons voir dans ce cours, nous allons travailler sur un projet de création d’une page de blog. Notre projet va donc porter sur Batman ! Vous pouvez voir sur la maquette ci-dessus qu’il est composé : d’un header avec un menu de navigation, une barre de recherche et un menu déroulant ; du corps principal avec le corps du texte, ainsi que d’une image ; d’un footer comprenant un second menu de navigation et des liens vers les réseaux sociaux. Ce cours inclut des textes, un projet fil rouge réalisé sous forme de screencast ainsi que des quizzes. Le projet de landing page vu tout au long du cours va vous permettre de mettre en pratique les éléments clés vus durant le cours. Vous devez avoir un peu pratiqué le HTML/CSS pour saisir l’ensemble du cours. Nous allons maintenant voir comment créer un squelette de page accessible, en utilisant la sémantique et les attributs ARIA. Le téléchargement des vidéos de nos cours est accessible pour les membres Premium. Vous pouvez toutefois les visionner en streaming gratuitement. Le téléchargement des vidéos de nos cours est accessible pour les membres Premium. Vous pouvez toutefois les visionner en streaming gratuitement. Si vous aimez mes cours, vous aimerez : beta.nx.academy Inclusive designer and digital accessibility specialist from Toronto, Canada.",Lisa Liskovoi,Codez un site web accessible avec HTML & CSS,"
                            Créez le squelette de votre page web - Codez un site web accessible avec HTML & CSS - OpenClassrooms
                    ",6 heures,"Inclusive designer and digital accessibility specialist from Toronto, Canada.","Inclusive designer and digital accessibility specialist from Toronto, Canada.",https://vimeo.com/472965212/
Comment suivre ce cours ?,"Ce cours couvre de nombreux aspects de la programmation de site web prenant en compte les contraintes d’accessibilité. Selon votre profil, votre objectif, vous aurez plusieurs manières possibles de suivre ce cours : Si vous travaillez sur ungros projet de développement webet avez besoin de compétences sur l’ensemble de la programmation accessible, vous pouvez suivre le cours entier : lire le texte et faire les quiz pour vérifier vos connaissances. Dans ce cas, je vous conseille vivement d’appliquer en parallèle, grâce aux exemples donnés à la fin de chaque chapitre. Si vous ne travaillez que surune partie spécifique de la programmation web, un élément particulier d’une page, je vous invite à passer directement au chapitre en question. Si, enfin,vous vous intéressez à l’accessibilité weben général, sans nécessairement vouloir appliquer, en ce cas vous pouvez passer le cours en revu, lire les résumés de chapitres et ne rentrer dans le détail des textes que quand le sujet vous intéresse particulièrement. Dans ce cours, vous allez découvrir les techniques qui vont vous permettre de coder des sites web accessibles à tous ! Quand on pense à l’accessibilité, on pense souvent aux personnes ayant destroubles visuels. Mais le principe même del’accessibilité est de rendre un site ou une application web utilisable par le plus grand nombre. Autrement dit, vous vous adressez à un public qui peut avoir : desdéficiences visuelles(aveugles, daltoniens, personnes ayant des glaucomes, etc.) ; desdéficiences de motricité(pour des personnes ayant subi un AVC, par exemple) ; une connaissance limitée devotre langue(publics étrangers). Par exemple, admettons que votre site dispose de vidéos. Le fait de les sous-titrer va les rendre accessibles aux personnes ayant des problèmes auditifs. Mais cela va aussi permettre aux personnes n’ayant pas de son sur leur ordinateur, ou à ceux ne parlant pas votre langue, de les comprendre. Faire un site web accessible, c’est donc créer un site utilisable et compréhensible pour le plus grand nombre de personnes. Vous trouverez dans ce cours : du textevous permettant : deprésenter les notionsen détail et donner des conseils, de donner desexemplesdes concepts que je présente, departager des liensvers des ressources complémentaires, telles que des articles de blog ; des quizvous permettant de valider les connaissances acquises durant le cours ; et, enfin,un projet “Tonight in Gotham” qui nous servira de cas d’applicationtout au long des chapitres. À chaque fin de chapitre, vous trouverez un cas pratique d'application des concepts à ce projet. Comme toujours avec les cours OpenClassrooms, il est important de pratiquer tout au long de ce cours. Je vous invite donc à essayer d’appliquer le plus possible les concepts. Vous pouvez, par exemple, le faire : via vos projets OpenClassrooms si vous suivez un parcours chez nous ; via un projet personnel (c’est souvent le bon moment de tester une nouvelle technologie ou un nouveau concept et de le faire progressivement) ; via votre travail (si vous êtes déjà développeur), en en parlant à vos collègues et/ou en essayant de l’intégrer à votre entreprise. En plus des snippets de code et des exemples d’applicationque vous allez pouvoir voir durant ce cours,nous allons travailler sur un projet. Ce projet va être lefil rouge de notre cours. Pour chaque chapitre de chaque partie,le cours se divisera généralement en deux grandes sections: une ou plusieurs sectionsnotions + exemples, où je vous expliquerai les concepts et où je vous donnerai des exemples d’application ; une dernière section où nous intégrerons ensemble la maquette d’une landing page au fil des chapitres. Vous pouvez dès à présent télécharger les sources du projet créé que nous allons implémentersur ce projet Figma. Vous pouvez trouver le code source de cette application sur cerepository GitHub. À chaque fin de chapitre, vous trouverez un lien GitHub qui vous permettra de voir l’état du code une fois les étapes du chapitre implémentées. Vous n’avez pas besoin de maîtriser Git et GitHub pour réaliser ce cours. Néanmoins, être familier avec le versioning, et notamment avec le concept de branche, va vous permettre de vous repérer plus facilement dans les modifications effectuées entre chaque chapitre. Pour en savoir plus sur l’utilisation de Git et GitHub, je vous invite à suivre le coursGérez du code avec Git et GitHub. Pour que vous puissiez mettre en pratique ce que nous allons voir dans ce cours, nous allons travailler sur un projet de création d’une page de blog. Notre projet va donc porter sur Batman ! Vous pouvez voir sur la maquette ci-dessus qu’il est composé : d’un header avec un menu de navigation, une barre de recherche et un menu déroulant ; du corps principal avec le corps du texte, ainsi que d’une image ; d’un footer comprenant un second menu de navigation et des liens vers les réseaux sociaux. Ce cours inclut des textes, un projet fil rouge réalisé sous forme de screencast ainsi que des quizzes. Le projet de landing page vu tout au long du cours va vous permettre de mettre en pratique les éléments clés vus durant le cours. Vous devez avoir un peu pratiqué le HTML/CSS pour saisir l’ensemble du cours. Nous allons maintenant voir comment créer un squelette de page accessible, en utilisant la sémantique et les attributs ARIA. Le téléchargement des vidéos de nos cours est accessible pour les membres Premium. Vous pouvez toutefois les visionner en streaming gratuitement. Le téléchargement des vidéos de nos cours est accessible pour les membres Premium. Vous pouvez toutefois les visionner en streaming gratuitement. Si vous aimez mes cours, vous aimerez : beta.nx.academy Inclusive designer and digital accessibility specialist from Toronto, Canada.",Lisa Liskovoi,Codez un site web accessible avec HTML & CSS,,6 heures,"Inclusive designer and digital accessibility specialist from Toronto, Canada.","Inclusive designer and digital accessibility specialist from Toronto, Canada.",
